{"$schema":"https://json-schema.org/draft/2020-12/schema","$id":"urn:aicontrolcenter:governance:v1:authorization-consumption-receipt","title":"GovernanceAuthorizationConsumptionReceipt","type":"object","additionalProperties":false,"required":["schema_version","claim_id","lifecycle_id","authorization_id","mutation_budget_id","execution_request_id","consumed_at","transaction_status","replay_sequence","replay_hash"],"properties":{"schema_version":{"const":"governance/v1"},"claim_id":{"$ref":"#/$defs/text"},"lifecycle_id":{"$ref":"#/$defs/text"},"authorization_id":{"$ref":"#/$defs/text"},"mutation_budget_id":{"$ref":"#/$defs/text"},"execution_request_id":{"$ref":"#/$defs/text"},"consumed_at":{"type":"string","format":"date-time"},"transaction_status":{"const":"COMMITTED"},"replay_sequence":{"oneOf":[{"type":"integer","minimum":0},{"type":"null"}]},"replay_hash":{"$ref":"#/$defs/nullableText"}},"$defs":{"text":{"type":"string","minLength":1},"nullableText":{"oneOf":[{"$ref":"#/$defs/text"},{"type":"null"}]}}}
