{"schema_version":"governance/v1","claim_id":"claim-synthetic-001","lifecycle_id":"lifecycle-synthetic-001","authorization_id":"authorization-synthetic-001","mutation_budget_id":"budget-synthetic-001","execution_request_id":"execution-request-synthetic-001","consumed_at":"2026-08-10T00:03:00+00:00","transaction_status":"COMMITTED","replay_sequence":1,"replay_hash":"digest-replay-synthetic-001"}
